{
  "schemaVersion": 2,
  "id": "enemy-ring",
  "projectileId": "ember-hard",
  "cooldown": 1.15,
  "actionType": "projectile",
  "emitters": [{
    "id": "ring",
    "projectileId": "ember-hard",
    "fireInterval": 1.15,
    "angleSource": "rotating",
    "distribution": "ring",
    "projectileCount": 10,
    "spreadDegrees": 360,
    "rotationDegreesPerShot": 11,
    "speedMultipliers": [0.72, 1.0]
  }]
}
