{"schemaVersion":2,"id":"enemy-pattern-4","projectileId":"enemy-soft","cooldown":0.2,"actionType":"projectile","emitters":[{"id":"emitter-4","projectileId":"enemy-soft","fireInterval":0.34,"angleSource":"rotating","distribution":"ring","projectileCount":5,"spreadDegrees":360.0,"rotationDegreesPerShot":11.0,"speedMultipliers":[0.82,1.0]}]}
