{"schemaVersion":2,"actionType":"projectile","id":"lancer-twin","projectileId":"player-needle","cooldown":0.06,"emitters":[{"id":"left","projectileId":"player-needle","fireInterval":0.06,"angleSource":"forward","distribution":"single","projectileCount":1,"spreadDegrees":0.0,"rotationDegreesPerShot":0.0,"speedMultipliers":[1.0]},{"id":"right","projectileId":"player-needle","fireInterval":0.06,"angleSource":"forward","distribution":"single","projectileCount":1,"spreadDegrees":0.0,"rotationDegreesPerShot":0.0,"speedMultipliers":[1.0]}]}
